[
  {
    "id": "jd-001",
    "source": "SYNTHETIC",
    "source_note": "合成 JD：公司化名，要求按 7 类岗位设计并带 differentiators",
    "title": "AI 产品经理（大模型应用）",
    "category": "AI_PRODUCT",
    "company_type": "合成公司",
    "city": "北京",
    "seniority": "MID",
    "responsibilities": [
      "负责基于大模型的客服机器人功能设计与 PRD 落地",
      "定义模型效果评测集与质量标准",
      "与算法/工程协作推进模型迭代",
      "分析用户反馈优化对话体验"
    ],
    "requirements": [
      "本科及以上",
      "有大模型应用产品经验",
      "熟悉评测集构建与 prompt 设计",
      "能独立完成需求拆解"
    ],
    "differentiators": [
      "强调评测集与质量标准——必须有评测经验才匹配"
    ],
    "raw_text": "AI 产品经理（大模型应用）（北京）\n岗位职责：\n1. 负责基于大模型的客服机器人功能设计与 PRD 落地\n2. 定义模型效果评测集与质量标准\n3. 与算法/工程协作推进模型迭代\n4. 分析用户反馈优化对话体验\n任职要求：\n1. 本科及以上\n2. 有大模型应用产品经验\n3. 熟悉评测集构建与 prompt 设计\n4. 能独立完成需求拆解"
  },
  {
    "id": "jd-002",
    "source": "SYNTHETIC",
    "source_note": "合成 JD：公司化名，要求按 7 类岗位设计并带 differentiators",
    "title": "AI 产品经理（数据平台方向）",
    "category": "AI_PRODUCT",
    "company_type": "合成公司",
    "city": "上海",
    "seniority": "MID",
    "responsibilities": [
      "负责数据标注平台的产品规划",
      "设计标注质量抽检流程",
      "协调外包团队完成数据生产",
      "输出平台数据看板"
    ],
    "requirements": [
      "本科及以上",
      "有 B 端数据产品经验",
      "有外包/供应商管理经验",
      "熟悉数据看板工具"
    ],
    "differentiators": [
      "B 端平台 + 外包管理——与面向 C 端对话产品完全不同"
    ],
    "raw_text": "AI 产品经理（数据平台方向）（上海）\n岗位职责：\n1. 负责数据标注平台的产品规划\n2. 设计标注质量抽检流程\n3. 协调外包团队完成数据生产\n4. 输出平台数据看板\n任职要求：\n1. 本科及以上\n2. 有 B 端数据产品经验\n3. 有外包/供应商管理经验\n4. 熟悉数据看板工具"
  },
  {
    "id": "jd-003",
    "source": "SYNTHETIC",
    "source_note": "合成 JD：公司化名，要求按 7 类岗位设计并带 differentiators",
    "title": "AI 产品实习生（校园招聘）",
    "category": "AI_PRODUCT",
    "company_type": "合成公司",
    "city": "深圳",
    "seniority": "INTERN",
    "responsibilities": [
      "协助撰写 PRD 与竞品分析",
      "跟进功能灰度与用户反馈整理",
      "参与模型效果人工评估"
    ],
    "requirements": [
      "本科在读",
      "每周实习 4 天以上",
      "逻辑清晰会用 Axure/Figma"
    ],
    "differentiators": [
      "实习岗：重潜力与时间投入，不要求大模型落地经验"
    ],
    "raw_text": "AI 产品实习生（校园招聘）（深圳）\n岗位职责：\n1. 协助撰写 PRD 与竞品分析\n2. 跟进功能灰度与用户反馈整理\n3. 参与模型效果人工评估\n任职要求：\n1. 本科在读\n2. 每周实习 4 天以上\n3. 逻辑清晰会用 Axure/Figma"
  },
  {
    "id": "jd-004",
    "source": "SYNTHETIC",
    "source_note": "合成 JD：公司化名，要求按 7 类岗位设计并带 differentiators",
    "title": "对话式 AI 产品负责人",
    "category": "AI_PRODUCT",
    "company_type": "合成公司",
    "city": "北京",
    "seniority": "SENIOR",
    "responsibilities": [
      "负责对话式 AI 产品线的整体规划",
      "搭建 0→1 团队与协作流程",
      "对留存与付费转化指标负责"
    ],
    "requirements": [
      "5 年以上产品经验",
      "有 0→1 产品线经验",
      "带过 5 人以上团队",
      "有对话类产品商业化经验"
    ],
    "differentiators": [
      "管理岗：要求带团队与商业化，与执行层完全不同"
    ],
    "raw_text": "对话式 AI 产品负责人（北京）\n岗位职责：\n1. 负责对话式 AI 产品线的整体规划\n2. 搭建 0→1 团队与协作流程\n3. 对留存与付费转化指标负责\n任职要求：\n1. 5 年以上产品经验\n2. 有 0→1 产品线经验\n3. 带过 5 人以上团队\n4. 有对话类产品商业化经验"
  },
  {
    "id": "jd-005",
    "source": "SYNTHETIC",
    "source_note": "合成 JD：公司化名，要求按 7 类岗位设计并带 differentiators",
    "title": "AI 产品运营（模型效果方向）",
    "category": "AI_PRODUCT",
    "company_type": "合成公司",
    "city": "杭州",
    "seniority": "JUNIOR",
    "responsibilities": [
      "运营模型效果评估社区与用户反馈渠道",
      "整理 bad case 并分类归档",
      "组织人工评估活动"
    ],
    "requirements": [
      "本科及以上",
      "有运营经验",
      "文案表达清晰",
      "对 AI 产品有兴趣"
    ],
    "differentiators": [
      "偏运营与社区——不要求产品设计与 PRD 能力"
    ],
    "raw_text": "AI 产品运营（模型效果方向）（杭州）\n岗位职责：\n1. 运营模型效果评估社区与用户反馈渠道\n2. 整理 bad case 并分类归档\n3. 组织人工评估活动\n任职要求：\n1. 本科及以上\n2. 有运营经验\n3. 文案表达清晰\n4. 对 AI 产品有兴趣"
  },
  {
    "id": "jd-006",
    "source": "SYNTHETIC",
    "source_note": "合成 JD：公司化名，要求按 7 类岗位设计并带 differentiators",
    "title": "后端开发工程师（Java/订单方向）",
    "category": "BACKEND",
    "company_type": "合成公司",
    "city": "深圳",
    "seniority": "MID",
    "responsibilities": [
      "负责订单服务设计与开发",
      "保障接口性能与稳定性",
      "建设发布与监控流程"
    ],
    "requirements": [
      "本科及以上",
      "熟悉 Java 与并发",
      "有高并发订单系统经验",
      "重视测试与代码质量"
    ],
    "differentiators": [
      "Java 订单方向——要求高并发交易经验"
    ],
    "raw_text": "后端开发工程师（Java/订单方向）（深圳）\n岗位职责：\n1. 负责订单服务设计与开发\n2. 保障接口性能与稳定性\n3. 建设发布与监控流程\n任职要求：\n1. 本科及以上\n2. 熟悉 Java 与并发\n3. 有高并发订单系统经验\n4. 重视测试与代码质量"
  },
  {
    "id": "jd-007",
    "source": "SYNTHETIC",
    "source_note": "合成 JD：公司化名，要求按 7 类岗位设计并带 differentiators",
    "title": "后端开发工程师（Go/基础设施）",
    "category": "BACKEND",
    "company_type": "合成公司",
    "city": "北京",
    "seniority": "SENIOR",
    "responsibilities": [
      "设计与实现内部基础设施服务",
      "优化服务网格与可观测性",
      "指导初中级工程师"
    ],
    "requirements": [
      "本科及以上",
      "精通 Go",
      "有服务网格/中间件开发经验",
      "有技术方案评审经验"
    ],
    "differentiators": [
      "Go 基础设施——不涉业务订单，要求中间件深度"
    ],
    "raw_text": "后端开发工程师（Go/基础设施）（北京）\n岗位职责：\n1. 设计与实现内部基础设施服务\n2. 优化服务网格与可观测性\n3. 指导初中级工程师\n任职要求：\n1. 本科及以上\n2. 精通 Go\n3. 有服务网格/中间件开发经验\n4. 有技术方案评审经验"
  },
  {
    "id": "jd-008",
    "source": "SYNTHETIC",
    "source_note": "合成 JD：公司化名，要求按 7 类岗位设计并带 differentiators",
    "title": "后端开发实习生",
    "category": "BACKEND",
    "company_type": "合成公司",
    "city": "成都",
    "seniority": "INTERN",
    "responsibilities": [
      "参与业务需求开发与测试",
      "编写单元测试与文档",
      "修复线上小问题"
    ],
    "requirements": [
      "本科在读",
      "熟悉任一后端语言",
      "每周实习 3 天以上"
    ],
    "differentiators": [
      "实习：语言不限，重学习意愿与时间"
    ],
    "raw_text": "后端开发实习生（成都）\n岗位职责：\n1. 参与业务需求开发与测试\n2. 编写单元测试与文档\n3. 修复线上小问题\n任职要求：\n1. 本科在读\n2. 熟悉任一后端语言\n3. 每周实习 3 天以上"
  },
  {
    "id": "jd-009",
    "source": "SYNTHETIC",
    "source_note": "合成 JD：公司化名，要求按 7 类岗位设计并带 differentiators",
    "title": "全栈工程师（独立产品线）",
    "category": "BACKEND",
    "company_type": "合成公司",
    "city": "远程",
    "seniority": "MID",
    "responsibilities": [
      "独立完成前端页面与后端接口开发",
      "部署与运维自有服务",
      "直接对接用户反馈"
    ],
    "requirements": [
      "有 React 经验",
      "有任一后端语言经验",
      "能独立部署与排障",
      "自我管理能力强"
    ],
    "differentiators": [
      "全栈 + 远程独立作战——不要求大团队协作经验"
    ],
    "raw_text": "全栈工程师（独立产品线）（远程）\n岗位职责：\n1. 独立完成前端页面与后端接口开发\n2. 部署与运维自有服务\n3. 直接对接用户反馈\n任职要求：\n1. 有 React 经验\n2. 有任一后端语言经验\n3. 能独立部署与排障\n4. 自我管理能力强"
  },
  {
    "id": "jd-010",
    "source": "SYNTHETIC",
    "source_note": "合成 JD：公司化名，要求按 7 类岗位设计并带 differentiators",
    "title": "资深后端（风控反欺诈）",
    "category": "BACKEND",
    "company_type": "合成公司",
    "city": "上海",
    "seniority": "SENIOR",
    "responsibilities": [
      "设计实时风控规则引擎",
      "对接设备指纹与黑产对抗数据",
      "对资损指标负责"
    ],
    "requirements": [
      "熟悉规则引擎与流式计算",
      "有反欺诈对抗经验",
      "对资损/拦截率指标负责过"
    ],
    "differentiators": [
      "风控对抗方向——要求黑产对抗与资损经验"
    ],
    "raw_text": "资深后端（风控反欺诈）（上海）\n岗位职责：\n1. 设计实时风控规则引擎\n2. 对接设备指纹与黑产对抗数据\n3. 对资损指标负责\n任职要求：\n1. 熟悉规则引擎与流式计算\n2. 有反欺诈对抗经验\n3. 对资损/拦截率指标负责过"
  },
  {
    "id": "jd-011",
    "source": "SYNTHETIC",
    "source_note": "合成 JD：公司化名，要求按 7 类岗位设计并带 differentiators",
    "title": "数据分析师（经营分析）",
    "category": "DATA_ANALYST",
    "company_type": "合成公司",
    "city": "上海",
    "seniority": "MID",
    "responsibilities": [
      "搭建经营指标体系与看板",
      "设计 A/B 实验并归因",
      "向业务输出可执行结论"
    ],
    "requirements": [
      "统计/数学相关本科",
      "熟练 SQL 与 Python",
      "有 A/B 实验经验",
      "能把结论讲给非技术同事"
    ],
    "differentiators": [
      "经营分析：重 A/B 实验与指标体系"
    ],
    "raw_text": "数据分析师（经营分析）（上海）\n岗位职责：\n1. 搭建经营指标体系与看板\n2. 设计 A/B 实验并归因\n3. 向业务输出可执行结论\n任职要求：\n1. 统计/数学相关本科\n2. 熟练 SQL 与 Python\n3. 有 A/B 实验经验\n4. 能把结论讲给非技术同事"
  },
  {
    "id": "jd-012",
    "source": "SYNTHETIC",
    "source_note": "合成 JD：公司化名，要求按 7 类岗位设计并带 differentiators",
    "title": "数据分析师（用户增长）",
    "category": "DATA_ANALYST",
    "company_type": "合成公司",
    "city": "北京",
    "seniority": "JUNIOR",
    "responsibilities": [
      "分析渠道投放与转化漏斗",
      "搭建留存预警监控",
      "支持增长团队的日常取数"
    ],
    "requirements": [
      "本科及以上",
      "熟练 SQL",
      "有增长/漏斗分析经验",
      "Excel 熟练"
    ],
    "differentiators": [
      "增长方向：渠道与漏斗，不做实验归因深挖"
    ],
    "raw_text": "数据分析师（用户增长）（北京）\n岗位职责：\n1. 分析渠道投放与转化漏斗\n2. 搭建留存预警监控\n3. 支持增长团队的日常取数\n任职要求：\n1. 本科及以上\n2. 熟练 SQL\n3. 有增长/漏斗分析经验\n4. Excel 熟练"
  },
  {
    "id": "jd-013",
    "source": "SYNTHETIC",
    "source_note": "合成 JD：公司化名，要求按 7 类岗位设计并带 differentiators",
    "title": "商业分析师（战略方向）",
    "category": "DATA_ANALYST",
    "company_type": "合成公司",
    "city": "上海",
    "seniority": "SENIOR",
    "responsibilities": [
      "支持管理层战略决策分析",
      "输出行业与竞品研究",
      "搭建财务与业务联合模型"
    ],
    "requirements": [
      "有咨询或战略分析背景",
      "结构化表达出色",
      "能独立主持高管汇报"
    ],
    "differentiators": [
      "战略/咨询路线——与取数型分析师完全不同"
    ],
    "raw_text": "商业分析师（战略方向）（上海）\n岗位职责：\n1. 支持管理层战略决策分析\n2. 输出行业与竞品研究\n3. 搭建财务与业务联合模型\n任职要求：\n1. 有咨询或战略分析背景\n2. 结构化表达出色\n3. 能独立主持高管汇报"
  },
  {
    "id": "jd-014",
    "source": "SYNTHETIC",
    "source_note": "合成 JD：公司化名，要求按 7 类岗位设计并带 differentiators",
    "title": "数据运营专员",
    "category": "DATA_ANALYST",
    "company_type": "合成公司",
    "city": "杭州",
    "seniority": "JUNIOR",
    "responsibilities": [
      "维护日常经营报表",
      "配合活动做数据抽取",
      "维护运营流程文档"
    ],
    "requirements": [
      "本科及以上",
      "熟练 SQL 与 Excel",
      "做事细致有文档习惯"
    ],
    "differentiators": [
      "偏执行：报表与文档，不要求建模与实验设计"
    ],
    "raw_text": "数据运营专员（杭州）\n岗位职责：\n1. 维护日常经营报表\n2. 配合活动做数据抽取\n3. 维护运营流程文档\n任职要求：\n1. 本科及以上\n2. 熟练 SQL 与 Excel\n3. 做事细致有文档习惯"
  },
  {
    "id": "jd-015",
    "source": "SYNTHETIC",
    "source_note": "合成 JD：公司化名，要求按 7 类岗位设计并带 differentiators",
    "title": "数据科学工程师（建模）",
    "category": "DATA_ANALYST",
    "company_type": "合成公司",
    "city": "深圳",
    "seniority": "SENIOR",
    "responsibilities": [
      "开发流失预警/推荐等模型",
      "建设特征平台与评估流程",
      "推动模型上线"
    ],
    "requirements": [
      "熟练 Python 建模",
      "有 ML 项目落地经验",
      "熟悉特征工程与离线在线一致性"
    ],
    "differentiators": [
      "建模工程师——要求 ML 落地，不是报表分析"
    ],
    "raw_text": "数据科学工程师（建模）（深圳）\n岗位职责：\n1. 开发流失预警/推荐等模型\n2. 建设特征平台与评估流程\n3. 推动模型上线\n任职要求：\n1. 熟练 Python 建模\n2. 有 ML 项目落地经验\n3. 熟悉特征工程与离线在线一致性"
  },
  {
    "id": "jd-016",
    "source": "SYNTHETIC",